id,question,answers,category,importance,source_page
ch11-p3-q01,繰延資産とは？,将来に繰延べられた特定の費用,theme11,A,121
ch11-p3-q02,繰延経理の根拠は？,効果の発現||収益との対応関係,theme11,A,121
ch11-p3-q03,静態論での繰延資産の資産性は？,売却価値がなく、資産性はない|換金価値がなく、資産性はない,theme11,A,121
ch11-p3-q04,動態論での繰延資産の資産性は？,期間損益計算の観点から繰延べられたものであり、資産性がある|期間損益計算の観点から繰延べられたもので資産性がある,theme11,A,121
ch11-p3-q05,概念フレームワークでの繰延資産の資産性は？,キャッシュの獲得に貢献する限り、資産性がある|キャッシュの獲得に貢献する限り資産性がある,theme11,A,121
ch11-p3-q06,現行制度上の繰延資産を列挙せよ。,創立費||開業費||開発費||株式交付費||社債発行費等,theme11,A,121
ch11-p3-q07,創立費および開業費の原則的取扱いは？,営業外費用,theme11,A,121
ch11-p5-q01,株式交付費の支出は、（①）取引ではなく、資金調達を行うために要するものであり、財務費用としての性格が強い。また、資金調達に要する費用を会社の（②）に反映させることが投資者に有用な情報を提供することになるため、株式交付費は、原則として（③）として処理する。ただし、これを繰延資産として計上することもできる。,資本||業績||費用（営業外費用）|営業外費用|費用,theme11,B,123
ch11-p5-q02,社債発行費は原則として（①）として処理するが、繰延資産として計上することもできる。社債発行者にとって、社債利息以外に社債発行費も含めて（②）と考えることができ、国際的な会計基準における償却方法との整合性も考慮し、繰延資産として計上した社債発行費は原則として（③）により償却する。なお、継続適用を要件として（④）による償却も認められる。,費用（営業外費用）|営業外費用|費用||資金調達費（コスト）|資金調達費|資金調達コスト||利息法||定額法,theme11,B,123
ch11-p5-q03,対価性を有するのれんを（①）といい、対価性を有しない企業が自ら創設したのれんを（②）という。企業会計上、その計上が認められるのは（①）のみであり、（②）は事実の開示という財務報告の目的に反し、未実現利益を計上するため認められない。,買入のれん（有償取得のれん）|買入のれん|有償取得のれん||自己創設のれん,theme11,B,123
ch11-p7-q01,会社法上、繰延資産が関連する規定は？,分配可能額の算定,theme11,B,125
ch11-p7-q02,分配可能額の計算で繰延資産を考慮する理由は？,換金価値がないため|換金価値を有しないため,theme11,B,125
ch11-p7-q03,社債発行費を繰延資産計上した場合の償却方法は？,利息法||定額法,theme11,B,125
ch11-p7-q04,社債発行費の償却方法が原則的に利息法である理由は？,資金調達コストだから|資金調達費だから,theme11,B,125
ch11-p7-q05,株式交付費を営業外費用とする理由は？,資本取引ではないため|資本取引に該当しないため,theme11,B,125
ch11-p7-q06,自己株式処分費用を繰延資産とする場合の名称は？,株式交付費,theme11,B,125
ch11-p7-q07,自己株式の取得・消却費用の制度上の取扱いは？,営業外費用,theme11,B,125
ch11-p7-q08,株式交付費と社債発行費の共通点は？,資金調達費である点|資金調達費であること,theme11,B,125
ch11-p7-q09,繰延資産と長期前払費用の違いは？,役務提供を受けているか否か|役務の提供を受けているか否か,theme11,B,125
ch12-p1-q01,外貨建取引は（①）の為替相場で換算し、決済時には（②）の為替相場で換算する。（①）と（②）の為替相場の変動から生ずる換算差額は、為替差損益として処理し、損益計算書では純額で（③）に表示する。,取引発生時||決済時||営業外損益,theme12,A,129
ch12-p1-q02,本店における外貨建資産負債の決算時の換算方法には（①）が用いられる。（①）とは、貨幣項目を決算時、非貨幣項目を取得時・発生時の為替相場で換算する方法をいう。この他に流動・非流動法、在外支店の中心的な換算方法である（②）、在外子会社の中心的換算方法である（③）がある。,貨幣・非貨幣法||テンポラル法||決算日レート法,theme12,A,129
ch12-p1-q03,外貨建債権債務は円貨では為替相場の変動リスクを負っているため外貨建の金額を（①）の為替相場で換算する。満期保有目的の債券は金銭債権との類似性を考慮し、（①）の為替相場で換算する。売買目的有価証券は円貨額による時価評価額を求める過程としての換算であり、（①）の為替相場で換算する。,決算時,theme12,A,129
ch12-p3-q01,外貨建取引の換算相場は？,取引発生時の為替相場,theme12,A,131
ch12-p3-q02,決算時における外貨建資産・負債の換算方法は？,決算日レート法||流動・非流動法||貨幣・非貨幣法||テンポラル法,theme12,A,131
ch12-p3-q03,個別財務諸表の中心的換算方法は？,貨幣・非貨幣法,theme12,A,131
ch12-p3-q04,在外支店の中心的換算方法は？,テンポラル法,theme12,A,131
ch12-p3-q05,在外子会社の中心的換算方法は？,決算日レート法,theme12,A,131
ch12-p3-q06,外貨建債権債務を決算時の為替相場で換算する理由は？,円貨では為替相場の変動リスクを負っているため|円貨で為替相場の変動リスクを負っているため,theme12,A,131
ch12-p3-q07,外貨建満期保有目的の債券を決算時の為替相場で換算する理由は？,金銭債権との類似性を考慮したため|金銭債権との類似性を考慮するため,theme12,A,131
ch12-p3-q08,外貨建売買目的有価証券を決算時の為替相場で換算する理由は？,円貨額による時価評価額を求める過程としての換算だから|円貨額による時価評価額を求める過程としての換算であるため,theme12,A,131
ch12-p5-q01,一取引基準とは、外貨建取引とその取引に係る代金決済取引を連続した（①）の取引とみなして会計処理を行う方法をいう。二取引基準とは、外貨建取引とその取引に係る代金決済取引を（②）の取引とみなして会計処理を行う方法をいう。,一つ（1個）|一つ|1個||別個,theme12,B,133
ch12-p5-q02,独立処理とは、為替予約等を外貨建取引とは（①）した別個の取引として会計処理を行う方法をいう。振当処理とは、為替予約等により確定する決済時における円貨額により外貨建取引等を換算し、直物為替相場との差額を期間（②）する方法をいう。,独立||配分,theme12,B,133
ch12-p5-q03,在外支店の中心的な換算方法は、その評価の属性に従った換算を行う（①）による。これに対して在外子会社は、在外支店とは異なり、現地国での活動が中心となるため中心的な換算方法は、（②）による。,テンポラル法||決算日レート法,theme12,B,133
ch12-p7-q01,為替差損益の処理方法を2つ示せ。,二取引基準||一取引基準,theme12,B,135
ch12-p7-q02,二取引基準とは？,外貨建取引と決済取引を別々に処理する方法|外貨建取引とその代金決済取引を別個の取引として処理する方法,theme12,B,135
ch12-p7-q03,一取引基準とは？,外貨建取引と決済取引を一体として処理する方法|外貨建取引とその代金決済取引を一つの取引として処理する方法,theme12,B,135
ch12-p7-q04,為替予約の処理方法を2つ示せ（原則的方法を先にあげること）。,独立処理||振当処理,theme12,B,135
ch12-p7-q05,独立処理とは？,外貨建金銭債権債務と為替予約を別個に換算する方法|外貨建金銭債権債務と為替予約を別個の取引として換算する方法,theme12,B,135
ch12-p7-q06,振当処理とは？,直先差額を期間配分する方法|直物為替相場と予約相場との差額を期間配分する方法,theme12,B,135
ch12-p7-q07,振当処理を適用する要件は？,ヘッジ会計の要件を満たすこと|ヘッジ会計の要件を満たす場合,theme12,B,135
ch12-p7-q08,在外子会社の資本項目の換算相場は？,取得・発生時の為替相場|取得時または発生時の為替相場,theme12,B,135
ch12-p7-q09,在外子会社の費用収益の原則的換算相場は？,期中平均相場|期中平均の為替相場,theme12,B,135
ch12-p7-q10,在外子会社の費用収益の例外的換算相場は？,決算時の為替相場|決算日レート,theme12,B,135
ch13-p1-q01,固定資産の減損とは、資産の（①）が低下し、その投資額を（②）することができない状態をいう。このような場合に（③）基準の下で当該資産の帳簿価額を回収可能価額まで臨時的に減額する手続が減損処理である。,収益性||回収||取得原価,theme13,A,139
ch13-p1-q02,減損処理は、金融投資に該当する売買目的有価証券を（①）で評価し、その評価差額を当期の（②）とする会計処理とは異なり、過大となった帳簿価額を切り下げ、将来に損失を繰り延べないために行われる会計処理である。減損会計の本質は、ストックの（③）にあるのではなく、フローの（④）にある。,時価||損益||評価||配分,theme13,A,139
ch13-p1-q03,企業が行う投資の回収形態は資産の種類に応じて異なる。棚卸資産は（①）、債権は契約、固定資産は（②）によりそれぞれ投資額を回収するのが一般的である。固定資産は、（②）をやめ売却することも可能であるから、（②）による回収額すなわち（③）と、売却による回収額すなわち（④）のいずれか高い金額が回収可能価額とされる。,販売||使用||使用価値||正味売却価額,theme13,A,139
ch13-p3-q01,減損とは？,収益性の低下による投資額の回収不能|収益性の低下により投資額を回収できない状態,theme13,A,141
ch13-p3-q02,減損処理とは？,回収可能性を反映した帳簿価額の減額処理|資産の回収可能性を反映した帳簿価額の減額処理,theme13,A,141
ch13-p3-q03,減損処理の意味は？,将来に損失を繰り延べないための処理|将来に損失を繰延べないための処理,theme13,A,141
ch13-p3-q04,減損処理と同じ意味を持つ処理を2つ示せ。,有価証券の減損||棚卸資産の評価減,theme13,A,141
ch13-p3-q05,減損処理と時価評価の違いは？,フローの配分||ストックの評価替え,theme13,A,141
ch13-p3-q06,減損損失の測定が行われる場合は？,割引前将来キャッシュ・フローが帳簿価額を下回る場合|割引前将来キャッシュフロー＜帳簿価額,theme13,A,141
ch13-p3-q07,減損損失額は？,帳簿価額－回収可能価額|帳簿価額から回収可能価額を控除した額,theme13,A,141
ch13-p3-q08,有形固定資産への投資額の回収手段を2つ示せ。,売却||使用,theme13,A,141
ch13-p3-q09,回収可能価額は？,正味売却価額と使用価値のいずれか高い金額|正味売却価額と使用価値の高い方,theme13,A,141
ch13-p5-q01,減損の兆候がある資産について減損損失の判定を行うのは、実務上の過大な負担を避けるためである。また、減損損失の判定に（①）の将来キャッシュ・フローを使うのは、成果の不確定な事業用資産の減損は測定が（②）になるため、減損の存在が相当程度確実な場合に限り減損処理を行うためである。,割引前||主観的,theme13,B,143
ch13-p5-q02,減損処理をした固定資産の（①）がその後に回復しても、減損処理を行わなかったと仮定した場合の（②）まで増額する処理（減損損失の戻入れ）は行わない。,収益性||帳簿価額,theme13,B,143
ch13-p5-q03,減損処理を行った資産について、減損処理後の（①）を新たな（②）として、新たに耐用年数や残存価額を見積もる。減損処理後は、その後の事業年度に適正な原価配分を行うため、毎期計画的、（③）に減価償却を行わなければならない。,帳簿価額||取得原価||規則的,theme13,B,143
ch13-p7-q01,減損処理の対象となる資産は？,固定資産,theme13,B,145
ch13-p7-q02,減損会計の適用単位は？,キャッシュ・フローを生み出す最小の単位|キャッシュフローを生み出す最小の単位,theme13,B,145
ch13-p7-q03,減損損失の認識の判定を行う場合は？,減損の兆候がある場合|減損の兆候があるとき,theme13,B,145
ch13-p7-q04,減損の兆候の例は？,キャッシュ・フローの継続的なマイナス|キャッシュフローの継続的マイナス,theme13,B,145
ch13-p7-q05,減損の兆候がある時に認識の判定をする理由は？,実務上の過大な負担を避けるため|実務上の過大な負担の回避,theme13,B,145
ch13-p7-q06,減損損失の認識の判定に割引前将来キャッシュ・フローを使う理由は？,減損の存在が相当程度に確実な場合のみ減損損失を認識するため|減損の存在が相当程度確実な場合のみ認識するため,theme13,B,145
ch13-p7-q07,翌期に減損損失の戻入れを行わない理由を2つ示せ。,減損の存在が相当程度に確実な場合のみ減損損失を認識するため|減損の存在が相当程度確実な場合のみ認識するため||過大な事務的負担を避けるため|過大な事務的負担の回避,theme13,B,145
ch13-p7-q08,減損処理後の減価償却は？,減損処理後の帳簿価額により行う|減損処理後の帳簿価額を基礎として行う,theme13,B,145
ch14-p1-q01,企業利益に対して課される法人税等は、利益の処分ではなく、企業会計上の（①）に該当する。企業会計上と課税所得計算上の（②）や（③）に相違がある場合、（①）である法人税等を適切に期間（④）し、税引前当期純利益と法人税等を合理的に（⑤）させる手続が税効果会計である。,費用||資産||負債||配分||対応,theme14,A,149
ch14-p1-q02,資産負債法とは、企業会計上と課税所得計算上の（①）や（②）の差額に予測税率を適用した額を税効果額とする方法である。繰延法とは、企業会計上の収益・費用と課税所得計算上の益金・損金の差額に現行税率を適用した額を税効果額とする方法である。制度上は（③）が採用されている。,資産||負債||資産負債法,theme14,A,149
ch14-p1-q03,繰延税金資産は、将来の法人税等の支払額を（①）する効果を有し、一般的には法人税等の（②）額に相当するため、資産としての性格を有する。繰延税金負債は、将来の法人税等の支払額を（③）する効果を有し、法人税等の（④）額に相当するため、負債としての性格を有する。,減額||前払||増額||未払,theme14,A,149
ch14-p3-q01,企業会計上の法人税等の性格は？,費用,theme14,A,151
ch14-p3-q02,繰延税金資産の性格は？,法人税等の前払|法人税等の前払い,theme14,A,151
ch14-p3-q03,繰延税金負債の性格は？,法人税等の未払|法人税等の未払い,theme14,A,151
ch14-p3-q04,繰延税金資産の資産性は？,将来キャッシュ・アウトフローの減額をもたらし資産性がある|将来のキャッシュアウトフローの減額をもたらす,theme14,A,151
ch14-p3-q05,繰延税金負債の負債性は？,将来キャッシュ・アウトフローの増額をもたらし負債性がある|将来のキャッシュアウトフローの増額をもたらす,theme14,A,151
ch14-p3-q06,税効果会計の方法を2つ示せ。,資産負債法||繰延法,theme14,A,151
ch14-p3-q07,資産負債法は、会計と税務の何の違いに着目するか？,資産と負債|資産・負債,theme14,A,151
ch14-p3-q08,繰延法は、会計と税務の何の違いに着目するか？,収益・費用と益金・損金|収益費用と益金損金,theme14,A,151
ch14-p3-q09,資産負債法で用いられる税率は？,予測税率,theme14,A,151
ch14-p3-q10,繰延法で用いられる税率は？,現行税率,theme14,A,151
ch14-p3-q11,税率変更時に繰延税金資産・負債を再計算する方法は？,資産負債法,theme14,A,151
ch14-p3-q12,繰越欠損金等に適用がある方法は？,資産負債法,theme14,A,151
ch14-p3-q13,その他有価証券評価差額金に適用がある方法は？,資産負債法,theme14,A,151
ch14-p5-q01,繰延法が対象とする差異を（①）といい、資産負債法が対象とする差異を（②）という。現行制度上は資産負債法が採用され、（②）だけでなく、（③）を含む（④）に対して税効果会計が適用される。なお、税効果会計の適用がない差異を（⑤）という。,期間差異||一時差異||繰越欠損金等||一時差異等||永久差異,theme14,B,153
ch14-p5-q02,一時差異には、将来の差異解消時に課税所得を減額させる（①）一時差異と、将来の差異解消時に課税所得を増額させる（②）一時差異がある。,将来減算||将来加算,theme14,B,153
ch14-p5-q03,繰延税金資産は、（①）一時差異の解消年度を含む期間に次のいずれかを満たすことにより、回収可能性があると判断される。①一時差異等加減算前（②）が発生する可能性が高い。②①以外で一時差異等加減算前（②）を発生させる（③）が存在する。③①・②以外で（④）一時差異の解消が見込まれる。,将来減算||課税所得||タックス・プランニング||将来加算,theme14,B,153
ch14-p7-q01,繰延法で税効果会計の適用がある差異は？,期間差異,theme14,B,155
ch14-p7-q02,資産負債法で税効果会計の適用がある差異は？,一時差異,theme14,B,155
ch14-p7-q03,現行制度上の税効果会計の適用対象は？,一時差異等,theme14,B,155
ch14-p7-q04,税効果会計の適用がない差異は？,永久差異,theme14,B,155
ch14-p7-q05,繰越欠損金等に税効果会計が適用される条件は？,将来の課税所得と相殺可能なこと|将来の課税所得と相殺できること,theme14,B,155
ch14-p7-q06,将来課税所得を減額させる一時差異は？,将来減算一時差異,theme14,B,155
ch14-p7-q07,将来課税所得を増額させる一時差異は？,将来加算一時差異,theme14,B,155
ch14-p7-q08,繰延税金資産の回収可能性とは？,将来の税負担の軽減効果|将来における税負担の軽減効果,theme14,B,155
ch14-p7-q09,繰延税金資産の回収可能性の判断基準を3つ示せ。,一時差異等加減算前課税所得の十分性||タックス・プランニングの存在||将来加算一時差異の十分性,theme14,B,155
ch15-p1-q01,貸借対照表上、資産性や負債性を持つものを資産の部や負債の部に記載し、それらに該当しないものは資産と負債の（①）として（②）の部に記載する。この結果、企業の（③）などの財政状態をより適切に表示できる。,差額||純資産||支払能力,theme15,A,161
ch15-p1-q02,会計情報で特に重要なのは、投資の成果を表す利益の情報であり、当期純利益とこれを生み出す（①）は重視されるため、純資産の部は（①）とそれ以外に区分する。この結果、損益計算書の当期純利益と（②）を除く（①）の当期変動額は一致する。なお、（①）は、株主から直接拠出された維持すべき（③）と企業が稼得し処分可能な（④）に区別される。,株主資本||資本取引||払込資本（拠出資本）|払込資本|拠出資本||留保利益,theme15,A,161
ch15-p1-q03,自己株式の性格の考え方には（①）説と（②）説がある。（①）説では、自己株式を換金性のある会社財産と捉え、資産とする。（②）説は、自己株式の取得を株主への会社財産の払戻し、つまり（③）と捉え、資本の控除とする。現行制度は（②）説をとり、（④）の控除として表示する。,資産||資本控除||資本取引||株主資本,theme15,A,161
ch15-p3-q01,資産と負債の差額を純資産として表示するものは？,支払能力等の財政状態|支払能力等の財政状態を示す貸借対照表,theme15,A,163
ch15-p3-q02,株主資本を区別する理由は？,株主資本が純利益を生み出し重要なため|株主資本が純利益を生み出す元本として重要なため,theme15,A,163
ch15-p3-q03,資本取引とは？,株主との直接的取引|株主との直接取引,theme15,A,163
ch15-p3-q04,非支配株主持分を純資産とする理由は？,返済義務がある負債でないため|返済義務のある負債ではないため,theme15,A,163
ch15-p3-q05,非支配株主持分を株主資本以外とする理由は？,親会社株主に帰属するものではないため|親会社の株主に帰属しないため,theme15,A,163
ch15-p3-q06,会社法上の株主資本の区分を3つ示せ。,資本金||準備金||剰余金,theme15,A,163
ch15-p3-q07,資産説の根拠は？,換金性のある会社財産だから|換金性のある会社財産であるため,theme15,A,163
ch15-p3-q08,資本控除説の根拠は？,会社財産の払戻しだから|会社財産の払戻しであるため,theme15,A,163
ch15-p3-q09,自己株式処分差益を資本剰余金とする理由は？,払込資本と同じだから|払込資本と同じ性格だから,theme15,A,163
ch15-p3-q10,株主資本等変動計算書の開示項目は？,純資産の部のすべての項目|純資産の部の全項目,theme15,A,163
ch15-p3-q11,株主資本等変動計算書における株主資本の開示は？,変動事由ごとの開示|変動事由別の開示,theme15,A,163
ch15-p3-q12,株主資本とその他の項目で開示に差がある理由は？,株主資本が重要だから|株主資本が重要であるため,theme15,A,163
ch15-p5-q01,新株予約権は、（①）のある負債ではなく、負債の部に表示するのが適当ではないため、（②）の部に記載する。また、株主とは異なる新株予約権者との直接的な取引によるものであり、（③）とは区別して表示する。,返済義務||純資産||株主資本,theme15,B,165
ch15-p5-q02,新株予約権に失効が生じ、純資産の増加が（①）との直接的な取引によらないこととなった場合は、会社は無償で提供されたサービスを（②）したと考えることができるので、失効に対応する部分を（③）として計上する。,株主||消費||利益（特別利益）|利益|特別利益,theme15,B,165
ch15-p5-q03,ストック・オプションを付与し、これに応じて企業が従業員等から取得するサービスは、その（①）に応じて費用として計上する。ストック・オプションを付与した場合に費用認識が行われるのは、付与されたストック・オプションを対価とし、これと引換えに企業に追加的にサービスが提供され、企業はそのサービスを（②）したと考えられるためである。,取得||消費,theme15,B,165
ch15-p7-q01,新株予約権を純資産とする理由は？,返済義務がある負債ではないため|返済義務のある負債ではないため,theme15,B,167
ch15-p7-q02,新株予約権を株主資本以外とする理由は？,株主に帰属するものではないため|株主に帰属しないため,theme15,B,167
ch15-p7-q03,ストック・オプションとは？,従業員等に報酬として付与する自社株式オプション|従業員等に報酬として付与される自社株式オプション,theme15,B,167
ch15-p7-q04,ストック・オプションの権利確定日以前の会計処理は？,取得に応じて費用計上し同額を純資産に新株予約権として計上する|サービスの取得に応じて費用計上し同額を新株予約権として計上する,theme15,B,167
ch15-p7-q05,ストック・オプションの費用計上額は？,公正な評価額のうち当期に発生したと認められる額|公正な評価額のうち当期発生額,theme15,B,167
ch15-p7-q06,ストック・オプションの費用認識の根拠は？,サービスを取得し消費しているため|サービスを取得・消費しているため,theme15,B,167
ch15-p7-q07,現金支出がなく、費用認識が行われる例は？,無償取得資産の減価償却|無償で取得した資産の減価償却,theme15,B,167
