id,question,answers,category,importance,source_page
ch01-p1-q01,財務報告の目的は、投資家の（①）に資するためにディスクロージャー（開示）制度の一環として投資のポジションと（②）を測定して開示することにある。会計情報に求められる最も基本的な特性を、意思決定有用性という。,意思決定||成果,theme01,A,15
ch01-p1-q02,投資のポジションを示す貸借対照表の構成要素には、資産、負債、純資産および株主資本がある。資産とは報告主体が支配している（①）をいい、（①）とは（②）の獲得に貢献する便益の源泉をいう。負債とは報告主体が支配している（①）を引き渡す（③）をいう。純資産とは資産と負債の（④）をいい、このうち株主に帰属する部分を（⑤）という。,経済的資源||キャッシュ||義務||差額||株主資本,theme01,A,15
ch01-p1-q03,投資の成果を示す損益計算書の最終値である（①）は、純資産の変動額のうち当期にリスクから解放された投資の成果である。投資のリスクからの解放とは、投資にあたって期待された（②）が事実として（③）することをいい、投資がリスクから解放された時点で純利益が認識される。,純利益|当期純利益||成果||確定,theme01,A,15
ch01-p3-q01,財務報告の目的は？,投資のポジションと成果の開示,theme01,A,17
ch01-p3-q02,投資のポジションを示す財務諸表は？,貸借対照表,theme01,A,17
ch01-p3-q03,投資の成果を示す財務諸表は？,損益計算書,theme01,A,17
ch01-p3-q04,最も基本的な会計情報の質的特性は？,意思決定有用性,theme01,A,17
ch01-p3-q05,資産とは？,報告主体が支配している経済的資源,theme01,A,17
ch01-p3-q06,経済的資源とは？,キャッシュの獲得に貢献する便益の源泉,theme01,A,17
ch01-p3-q07,負債とは？,報告主体が支配している経済的資源を引き渡す義務,theme01,A,17
ch01-p3-q08,純資産とは？,資産と負債の差額,theme01,A,17
ch01-p3-q09,株主資本とは？,純資産のうち株主に帰属する部分,theme01,A,17
ch01-p3-q10,純利益とは？,純資産の変動額のうちリスクから解放された投資の成果,theme01,A,17
ch01-p3-q11,リスクからの解放とは？,期待された成果が事実として確定すること,theme01,A,17
ch01-p3-q12,純利益はいつ認識されるか？,投資がリスクから解放された時点,theme01,A,17
ch01-p5-q01,会計情報に求められる最も基本的な質的特性を意思決定有用性という。意思決定有用性を直接支える特性に意思決定との関連性と（①）性があり、意思決定有用性の一般的制約となる特性に内的整合性と（②）性がある。なお、一般的な比較の視点には時系列比較と（③）比較がある。,信頼||比較可能||企業間,theme01,B,19
ch01-p5-q02,企業が行う投資は、その事前の期待の相違から（①）と（②）に区別される。（①）は時価の変動を期待した投資であり、金融資産は時価で評価し、評価差額を当期の損益とする。（②）は使用や販売によるキャッシュの獲得を期待した投資であり、事業用資産は通常（③）で評価する。,金融投資||事業投資||取得原価,theme01,B,19
ch01-p5-q03,事業用資産の（①）は、当期の費用と次期以降の費用に（②）される＜費用配分の原則＞。当期に経済価値の（③）があり＜発生主義＞、また、当期の実現収益に（④）する部分が当期の費用として認識される＜費用収益対応の原則＞。,取得原価||配分||費消||対応,theme01,B,19
ch01-p7-q01,比較可能性における比較の視点は？,時系列比較||企業間比較,theme01,B,21
ch01-p7-q02,財務諸表の構成要素のうち他から独立して定義されているものは？,資産||負債,theme01,B,21
ch01-p7-q03,財務諸表の構成要素のうち最も重視されるものは？,純利益,theme01,B,21
ch01-p7-q04,財務諸表の構成要素のうち重視されるものは？,純利益||株主資本,theme01,B,21
ch01-p7-q05,認識と測定とは？,いつ||いくら,theme01,B,21
ch01-p7-q06,金融投資とは？,時価の変動を期待した投資,theme01,B,21
ch01-p7-q07,金融資産の評価は？,時価,theme01,B,21
ch01-p7-q08,事業投資とは？,使用や販売によるキャッシュの獲得を期待した投資,theme01,B,21
ch01-p7-q09,事業用資産の評価は？,取得原価,theme01,B,21
ch01-p7-q10,費用配分とは？,事業用資産の取得原価を費用と資産に配分すること,theme01,B,21
ch01-p7-q11,費用の発生とは？,経済価値の費消,theme01,B,21
ch02-p1-q01,真実性の原則とは、企業の（①）と（②）に関する真実な報告を要求する原則であり、ここでの真実性は（③）を意味する。,財政状態||経営成績||相対的真実性|相対的真実,theme02,A,27
ch02-p1-q02,正規の簿記の原則とは、正確な（①）の作成と誘導法による財務諸表の作成を要請する原則である。正規の簿記の要件には、（②）＜すべての取引を記録すること＞、（③）＜客観的証拠により記録すること＞、（④）＜秩序正しく記録すること＞がある。,会計帳簿||網羅性||検証性||秩序性,theme02,A,27
ch02-p1-q03,資本取引は株主との間での（①）の直接的増減取引をいい、損益取引は資本の運用取引であり、間接的な資本の増減をもたらす。両者の区別は期間損益計算の適正化のために不可欠である。各々の取引から生ずる剰余金を資本剰余金、利益剰余金といい、両者を（②）してはならない。,期首株主資本||混同,theme02,A,27
ch02-p1-q04,財務諸表の明瞭な表示を要求する（①）原則が明瞭性の原則である。明瞭表示のためには、財務諸表を適正に作成し、会計方針等の開示を要する。,報告|表示,theme02,A,27
ch02-p3-q01,真実性の原則における真実は？,相対的真実|相対的真実性,theme02,A,29
ch02-p3-q02,相対的真実とならざるを得ない理由は？,複数の会計処理の存在||見積りの介入,theme02,A,29
ch02-p3-q03,正規の簿記の要件は？,網羅性||検証性||秩序性,theme02,A,29
ch02-p3-q04,正規の簿記の原則が求める財務諸表の作成方法は？,誘導法,theme02,A,29
ch02-p3-q05,資本取引とは？,株主との直接的取引,theme02,A,29
ch02-p3-q06,損益取引とは？,株主資本の利用による間接的増減取引,theme02,A,29
ch02-p3-q07,資本取引と損益取引の区別が必要な理由は？,適正な期間損益計算のため,theme02,A,29
ch02-p3-q08,会計方針とは？,会計処理の原則及び手続|会計処理の原則および手続,theme02,A,29
ch02-p3-q09,会計方針の具体例を1つ示せ。,有価証券の評価基準および評価方法,theme02,A,29
ch02-p3-q10,後発事象とは？,貸借対照表日後に発生した重要な事象,theme02,A,29
ch02-p3-q11,後発事象の開示が必要な理由は？,補足情報として有用なため,theme02,A,29
ch02-p3-q12,財務諸表の修正を要する後発事象の名称は？,修正後発事象,theme02,A,29
ch02-p5-q01,継続性の原則とは、会計処理の（①）の継続適用を要求する原則である。この原則が適用されるのは、一つの会計事実に対して複数の会計処理の（①）が認められる場合であり、問題となるのは、一般に公正妥当と認められた方法間で変更を行う場合である。継続性の原則は、財務諸表の（②）の可能性を確保し、経営者の（③）を排除することを目的とする。なお、継続性の変更が認められるのは、合理的な変更、すなわち（④）がある場合に限られる。,原則及び手続|原則および手続||期間比較||利益操作||正当な理由,theme02,B,31
ch02-p5-q02,保守主義の原則とは、企業の財政に不利な影響を及ぼす可能性がある場合の（①）な会計処理を要求する原則である。,健全,theme02,B,31
ch02-p5-q03,単一性の原則とは、財務諸表の（①）、（②）を要請する原則である。,実質一元||形式多元,theme02,B,31
ch02-p5-q04,重要性の原則とは、重要性の乏しい項目に対する（①）な処理を容認した原則であり、重要性の判断は、（②）と（③）の重要性で行われる。,簡便||科目||金額,theme02,B,31
ch02-p7-q01,継続性の原則の前提は？,複数の会計処理の存在,theme02,B,33
ch02-p7-q02,継続性の原則における正当な理由の具体例は？,貨幣価値の著しい変動等,theme02,B,33
ch02-p7-q03,継続性の原則の必要性は？,期間比較性の確保||利益操作の排除,theme02,B,33
ch02-p7-q04,正当な理由による変更の前提は？,認められた方法間の変更,theme02,B,33
ch02-p7-q05,正当な理由による変更の本質は？,より合理的な方法への変更,theme02,B,33
ch02-p7-q06,保守主義とは？,費用の早期・収益の慎重な計上を要請する会計思考,theme02,B,33
ch02-p7-q07,保守主義の原則の限度は？,認められた方法であること,theme02,B,33
ch02-p7-q08,保守主義的な会計処理の例を1つ示せ。,部分純資産直入法,theme02,B,33
ch02-p7-q09,単一性の原則にいう財務諸表の作成目的は？,株主総会提出目的||信用目的||租税目的,theme02,B,33
ch02-p7-q10,単一性の原則の要請内容は？,実質一元||形式多元,theme02,B,33
ch02-p7-q11,重要性の判断基準は？,科目の重要性||金額の重要性,theme02,B,33
ch02-p7-q12,重要性の原則の適用例を1つ示せ。,貯蔵品の買入時費用処理等,theme02,B,33
ch03-p1-q01,静態論における資産の本質は、（①）にあり、動態論では資産を支出（②）項目等とみる。これに対して、概念フレームワークでは、報告主体が支配している（③）、すなわち（④）に貢献する便益の源泉と捉えている。,売却価値|換金価値||未費用||経済的資源||キャッシュの獲得,theme03,A,31
ch03-p1-q02,事業用資産は、損益計算との関連から（①）と（②）に区別される。（①）とは、将来現金化が予定される資産をいい、将来費用化が予定される資産が（②）である。（①）の評価は（③）を基礎とし、（②）の評価は（④）を基礎とする。,貨幣性資産||費用性資産||収入額||支出額,theme03,A,31
ch03-p1-q03,費用性資産の取得原価を基礎として貸借対照表価額を決定する考え方を（①）基準という。（①）基準では、取得原価を基礎に資産を計上するため評価益が計上されず、収益の認識基準としての（②）と整合的である。費用性資産の取得原価は、（③）の原則により、当期の費用と次期以降の費用、すなわち資産に配分される。,取得原価||実現主義||費用配分,theme03,A,31
ch03-p3-q01,静態論の資産とは？,売却価値がある財産|換金価値がある財産,theme03,A,33
ch03-p3-q02,動態論の資産とは？,前払の費用|前払費用,theme03,A,33
ch03-p3-q03,概念フレームワークの資産とは？,報告主体が支配している経済的資源,theme03,A,33
ch03-p3-q04,経済的資源とは？,キャッシュの獲得に貢献する便益の源泉,theme03,A,33
ch03-p3-q05,事業投資に係る資産を損益計算との関係から2つに分類せよ。,貨幣性資産||費用性資産,theme03,A,33
ch03-p3-q06,貨幣性資産の評価額は？,回収可能価額|回収可能額,theme03,A,33
ch03-p3-q07,原価主義とは？,資産を取得原価で評価する考え方,theme03,A,33
ch03-p3-q08,原価主義の根拠は？,処分可能利益の算定||検証性・実行可能性||受託責任の遂行,theme03,A,33
ch03-p3-q09,原価主義と整合的な収益の認識基準は？,実現主義,theme03,A,33
ch03-p3-q10,原価主義の資産評価面での欠点は？,資産評価額が時価と乖離する,theme03,A,33
ch03-p3-q11,原価主義の損益計算面での欠点は？,同一価格水準の損益計算ができない,theme03,A,33
ch03-p5-q01,資本維持には、（①）、実質資本維持、実体資本維持があるが、取得原価主義のもとでは（①）しか果たすことができない。,名目資本維持,theme03,B,35
ch03-p5-q02,資産の測定値には、過去の購買市場の価格に基づく（①）、現在の購買市場の価格に基づく（②）、現在の売却市場の価格に基づく（③）、将来の売却市場の価格に基づく（④）がある。,取得原価||再調達原価||正味売却価額||割引現在価値,theme03,B,35
ch03-p5-q03,静態論では、負債は法的な（①）に限定されるが、動態論での負債は将来の支出要因を意味し、必ずしも法的な（①）に限定されない。,確定債務,theme03,B,35
ch03-p7-q01,取得原価主義で維持される資本は？,名目資本,theme03,B,37
ch03-p7-q02,一般物価の変動を加味した資本維持における資本は？,実質資本,theme03,B,37
ch03-p7-q03,個別物価の変動を加味した資本維持における資本は？,実体資本,theme03,B,37
ch03-p7-q04,過去の購買市場の価格に基づく測定値は？,取得原価,theme03,B,37
ch03-p7-q05,現在の購買市場の価格に基づく測定値は？,再調達原価,theme03,B,37
ch03-p7-q06,現在の売却市場の価格に基づく測定値は？,正味売却価額,theme03,B,37
ch03-p7-q07,将来の売却市場の価格に基づく測定値は？,割引現在価値,theme03,B,37
ch03-p7-q08,静態論の負債とは？,法的な確定債務|確定債務,theme03,B,37
ch03-p7-q09,動態論の負債とは？,将来の支出要因,theme03,B,37
ch03-p7-q10,概念フレームワークでの負債とは？,経済的資源を引き渡す義務,theme03,B,37
ch04-p1-q01,貸借対照表は、企業の（①）ないし（②）を示す財務諸表であり、貸借対照表日におけるすべての資産、負債および純資産の貸借対照表への記載を要求した原則を（③）という。,財政状態||投資のポジション||貸借対照表完全性の原則,theme04,A,41
ch04-p1-q02,貸借対照表における総額主義の原則は、資産と負債または純資産との相殺を禁ずる原則であり、企業の財政的な（①）を示すために要請される。,規模,theme04,A,41
ch04-p1-q03,貸借対照表項目の配列は、（①）を示す見地から流動性配列法が原則であるが、固定設備が多い特定の業種では（②）を示す見地から固定性配列法がとられることもある。,財務流動性|支払能力||財務健全性,theme04,A,41
ch04-p1-q04,貸借対照表の科目の分類基準には、（①）と（②）がある。（①）は企業の正常な（③）内にある資産や負債を流動項目とし、それ以外を固定項目とする基準をいう。（②）は貸借対照表日の翌日以後1年以内に期限が到来するものを流動項目、それ以外を固定項目とする基準をいう。,正常営業循環基準||1年基準|一年基準||営業循環過程,theme04,A,41
ch04-p3-q01,貸借対照表で示されるものは？,財政状態||投資のポジション,theme04,A,43
ch04-p3-q02,貸借対照表にすべての資産、負債、純資産の記載を要求する原則は？,貸借対照表完全性の原則,theme04,A,43
ch04-p3-q03,資産・負債の配列法は？　原則と例外を答えよ。,流動性配列法||固定性配列法,theme04,A,43
ch04-p3-q04,企業の財務流動性を示す資産・負債の配列法は？,流動性配列法,theme04,A,43
ch04-p3-q05,企業の財務健全性を示す資産・負債の配列法は？,固定性配列法,theme04,A,43
ch04-p3-q06,貸借対照表科目の分類基準は？,正常営業循環基準||1年基準|一年基準,theme04,A,43
ch04-p3-q07,貸借対照表の総額主義とは？,資産と負債・純資産の相殺禁止|資産と負債または純資産の相殺禁止,theme04,A,43
ch04-p3-q08,貸借対照表における総額主義の根拠は？,企業の財政規模の明示,theme04,A,43
ch04-p3-q09,貸借対照表における総額主義の例外は？,繰延税金資産と繰延税金負債の相殺表示,theme04,A,43
ch04-p5-q01,損益計算書において取引の量的な（①）を示すために収益と費用の相殺を禁じたのが（②）の原則である。損益計算書における（②）の例外には、売上・仕入高からの値引等の控除や為替差損益の純額表示等がある。,規模||総額主義,theme04,B,45
ch04-p5-q02,損益計算書に表示される利益の考え方には、企業の（①）を示すべきとする当期業績主義と、企業の（②）を示すべきとする包括主義がある。現行の損益計算書は包括主義を採用するが、区分利益として当期業績主義的な利益である（③）も併せて示すことで両者の考え方を折衷している。,短期的収益力|経常収益力||長期的収益力||経常利益,theme04,B,45
ch04-p5-q03,費用収益対応表示の原則は、損益計算書に関連する収益と費用の対応表示を求める原則である。収益と費用の対応関係には、（①）と（②）がある。（①）とは生産物を媒介とした個別的・直接的な因果関係を有する対応をいい、（②）とは期間を媒介とした間接的な対応関係をいう。これ以外に単なる取引の（③）に着目した期間外損益項目の対応表示も行われる。,個別的対応||期間的対応||同質性,theme04,B,45
ch04-p7-q01,損益計算書で明らかにされるものは？,経営成績||投資の成果,theme04,B,47
ch04-p7-q02,損益計算書の総額主義の根拠は？,取引の量的規模を示すため,theme04,B,47
ch04-p7-q03,損益計算書の総額主義の例外は？,純売上高・純仕入高||為替差損益||売買目的有価証券の評価・売却損益,theme04,B,47
ch04-p7-q04,現行の損益計算書上の当期業績主義的利益は？,経常利益,theme04,B,47
ch04-p7-q05,当期業績主義的利益が示すのは？,短期的収益力|経常収益力,theme04,B,47
ch04-p7-q06,現行の損益計算書上の包括主義による利益は？,当期純利益,theme04,B,47
ch04-p7-q07,包括主義的利益が示すのは？,長期的収益力,theme04,B,47
ch04-p7-q08,対応原則の意味は？,費用の認識原則||費用収益対応表示の原則,theme04,B,47
ch04-p7-q09,費用と収益の因果的な対応関係の種類は？,個別的対応||期間的対応,theme04,B,47
ch04-p7-q10,個別的対応とは？,生産物を媒介にした直接的な対応,theme04,B,47
ch04-p7-q11,個別的対応の例は？,売上高と売上原価,theme04,B,47
ch04-p7-q12,期間的対応とは？,期間を媒介にした間接的な対応,theme04,B,47
ch04-p7-q13,期間的対応の例は？,売上高と給料,theme04,B,47
ch05-p1-q01,支出や収入をどの会計期間における費用や収益とするかの問題、つまり費用と収益の期間帰属の決定を（①）といい、費用や収益の金額を決めることを（②）という。（①）と（②）を合わせて（③）という。,認識||測定||計上,theme05,A,61
ch05-p1-q02,費用と収益を現金の（①）時点で認識する会計を現金主義会計といい、経済価値の増減、すなわち（②）時点で費用や収益を認識する会計を発生主義会計という。,収支||発生,theme05,A,61
ch05-p1-q03,現金主義会計では、現金仕入を売上原価、現金売上を売上高とし、固定資産の取得に係る支出を費用とする。発生主義会計では、信用取引を加味し、売上に対応する売上原価のみが計上され、固定資産については費用配分手続である減価償却が行われる。（①）が行われ、恒常的（②）を有し、多くの（③）を有する現代の企業に現金主義会計は適合せず、発生主義会計が適している。,信用取引|掛取引||在庫|棚卸資産在庫||固定資産|固定設備,theme05,A,61
ch05-p3-q01,費用・収益の認識とは？,費用・収益の期間帰属の決定,theme05,A,63
ch05-p3-q02,費用・収益の測定とは？,費用・収益の金額の決定,theme05,A,63
ch05-p3-q03,現金主義とは？,現金収支により費用・収益を認識する考え方,theme05,A,63
ch05-p3-q04,現金主義会計とは？,現金主義に基づく会計,theme05,A,63
ch05-p3-q05,現金主義での費用・収益の測定基準は？,収支額基準,theme05,A,63
ch05-p3-q06,発生主義会計とは？,発生主義に基づく会計,theme05,A,63
ch05-p3-q07,発生主義での費用・収益の認識時点は？,経済価値の増減,theme05,A,63
ch05-p3-q08,現金主義会計から発生主義会計へ移行した環境要因を3つ示せ。,信用取引の発達||在庫の恒常化||固定資産の増大,theme05,A,63
ch05-p3-q09,発生主義会計の特徴を2つ示せ。,企業活動に即している||合理的な対応計算ができる,theme05,A,63
ch05-p5-q01,企業の各期間の（①）の合計は企業の全生涯を仮定した場合における全体期間の（①）に一致するとの考えを一致の原則という。また、全体期間の（①）は全体期間の（②）にも一致する。純利益も、包括利益もこのような（①）計算が（②）を基礎とするという制約を満たす。,利益||キャッシュ・フロー,theme05,B,65
ch05-p5-q02,発生主義による損益計算は、期間収益から期間費用を差し引いて行われる。期間収益と期間費用は（①）に基づいて計上されるため、期間損益計算は（①）を期間（②）したものであるといわれる。,キャッシュ・フロー||配分,theme05,B,65
ch05-p5-q03,現金主義会計による利益は、現金収入と現金支出との差額として算出されるため（①）を有している。これに対して発生主義会計による利益は、経済価値の増減に着目したものであるため、（②）を有している。,処分可能性||業績指標性,theme05,B,65
ch05-p7-q01,各期の利益の合計と全体期間の利益が一致するという原則は？,一致の原則,theme05,B,67
ch05-p7-q02,全体期間の損益計算と収支計算の関係を算式で示せ。,全体期間の損益計算＝全体期間の収支計算|全体期間の損益計算=全体期間の収支計算,theme05,B,67
ch05-p7-q03,現金主義会計による利益が有する性格は？,処分可能性,theme05,B,67
ch05-p7-q04,発生主義会計による利益が有する性格は？,業績指標性,theme05,B,67
ch05-p7-q05,発生主義会計による利益計算の目的は？,収益力の算定表示,theme05,B,67
ch05-p7-q06,キャッシュ・フロー計算の目的は？,キャッシュ・フロー生成能力の表示,theme05,B,67
ch05-p7-q07,時価主義と整合的な損益の認識基準は？,発生主義,theme05,B,67
ch05-p7-q08,原価主義と整合的な損益の認識基準は？,実現主義,theme05,B,67
ch06-p1-q01,実現主義とは、（①）の認識を（②）の時点で行う考え方をいう。（②）とは、財やサービスの（③）と貨幣性資産の受領による（④）の成立をいう。実現主義によれば、収益計上の（⑤）と金額の（⑥）を確保することができる。,収益||実現||移転||対価||確実性||客観性,theme06,A,73
ch06-p1-q02,投資のリスクとは、投資の成果の（①）をいい、投資のリスクからの解放とは、投資にあたって期待された成果が事実として（②）することをいう。投資がリスクから解放された段階で（③）が認識される。（③）は、収益から費用を控除して計算されるのであるから、収益と費用も投資がリスクから解放された段階で認識されるといえる。,不確定性||確定||純利益,theme06,A,73
ch06-p1-q03,（①）の変動を期待した（②）は、（①）の変動額がリスクから解放された投資の成果とみられるため、（①）で評価し、帳簿価額との差額を（③）とする。（①）の変動を期待せず、使用や販売によるキャッシュの獲得を期待した（④）は、キャッシュの獲得により投資がリスクから解放されたものとみられるため、（⑤）で評価し、これを（⑥）する。,時価||金融投資||当期の損益||事業投資||取得原価||費用配分,theme06,A,73
ch06-p3-q01,企業会計原則における収益の認識基準は？,実現主義,theme06,A,75
ch06-p3-q02,実現主義とは？,収益を実現の時点で認識する考え方,theme06,A,75
ch06-p3-q03,収益の実現の具体的要件を2つ示せ。,財やサービスの移転||対価の成立,theme06,A,75
ch06-p3-q04,実現主義の採用根拠は？,収益計上の確実性と金額の客観性を満たす|収益計上の確実性と金額の客観性,theme06,A,75
ch06-p3-q05,実現主義と結びつく資産の評価基準は？,取得原価基準,theme06,A,75
