id,question,answers,category,importance,source_page
ch06-p3-q06,実現主義が原価主義と整合的な理由は？,評価益を計上しないため|評価益を計上しない,theme06,A,75
ch06-p3-q07,投資のリスクからの解放は何の認識規準か？,純利益,theme06,A,75
ch06-p3-q08,投資のリスクとは？,投資の成果の不確定性,theme06,A,75
ch06-p3-q09,リスクからの解放とは？,期待された成果の確定|投資にあたって期待された成果が事実として確定すること,theme06,A,75
ch06-p5-q01,収益認識の基本となる原則は、約束した（①）または（②）の顧客への（③）を、その（①）または（②）と交換に企業が権利を得ると見込む（④）で描写するように（⑤）することである。,財||サービス||移転||対価の額||収益を認識,theme06,B,77
ch06-p5-q02,基本となる原則に従って収益を認識するために、次の5つのステップを適用する。(1) 顧客との（①）を識別する。(2)（①）における（②）を識別する。(3)（③）を算定する。(4)（①）における（②）に（③）を配分する。(5)（②）を充足した時にまたは充足するにつれて（④）する。,契約||履行義務||取引価格||収益を認識,theme06,B,77
ch06-p5-q03,約束した（①）や（②）（資産）を顧客に（③）することにより（④）を充足した時にまたは充足するにつれて、充足した（④）に配分された額で（⑤）する。資産が移転するのは、顧客が当該資産に対する（⑥）を獲得した時または獲得するにつれてである。,財||サービス||移転||履行義務||収益を認識||支配,theme06,B,77
ch06-p7-q01,収益認識基準の対象となる収益は？,顧客との契約により生ずる収益,theme06,B,79
ch06-p7-q02,収益認識基準の基本となる原則は？,約束した財やサービスの顧客への移転を、当該財やサービスと交換に企業が権利を得ると見込む対価の額で描写するように、収益を認識することである|約束した財やサービスの顧客への移転を当該財やサービスと交換に企業が権利を得ると見込む対価の額で描写するように収益を認識すること,theme06,B,79
ch06-p7-q03,収益認識の5つのステップは？,顧客との契約を識別する||契約における履行義務を識別する||取引価格を算定する||契約における履行義務に取引価格を配分する||履行義務を充足した時にまたは充足するにつれて収益を認識する,theme06,B,79
ch06-p7-q04,資産が移転するのは？,顧客が当該資産に対する支配を獲得したとき|顧客が当該資産に対する支配を獲得した時,theme06,B,79
ch06-p7-q05,商品販売における原則的な具体的認識基準は？,検収基準,theme06,B,79
ch07-p1-q01,棚卸資産の（①）は、売上高と（②）的な（③）関係を有する売上原価と次期以後の費用となる期末棚卸資産原価とに配分される。通常の販売目的で保有する棚卸資産は、（①）を貸借対照表価額とし、期末の（④）が（①）より下落している場合には、当該（④）をもって貸借対照表価額とする。この場合に（①）と（④）との差額は、当期の（⑤）として処理する。,取得原価||個別||対応||正味売却価額||費用,theme07,A,85
ch07-p1-q02,通常の販売目的で保有する棚卸資産の収益性の低下による帳簿価額の切下げは、資産を時価で評価し、評価差額を当期の（①）とする会計処理とは異なり、（②）基準の下で、（③）性を反映させるために過大な帳簿価額を減額し、将来に（④）を繰り延べないために行われる会計処理である。,損益||取得原価||回収可能||損失,theme07,A,85
ch07-p1-q03,先入先出法は、一般的な物の流れに即しており、棚卸資産が期末の時価に近い価格水準で評価される。しかし、価格変動時に同一価格水準での収益と費用の（①）計算ができず、特に価格上昇時に（②）が計上される。,対応||保有利益,theme07,A,85
ch07-p3-q01,棚卸資産とは？,営業目的の資産,theme07,A,87
ch07-p3-q02,棚卸資産の原則的な期末評価額は？,取得原価,theme07,A,87
ch07-p3-q03,棚卸資産の期末評価額は？,取得原価と正味売却価額の低い金額|取得原価と正味売却価額のいずれか低い金額,theme07,A,87
ch07-p3-q04,棚卸資産の資金回収手段は？,販売,theme07,A,87
ch07-p3-q05,収益性の低下による簿価切下げの意味は？,将来に損失を繰り延べない|将来に損失を繰り延べないこと,theme07,A,87
ch07-p3-q06,連続意見書での低価基準の採用根拠は？,保守主義,theme07,A,87
ch07-p3-q07,低価基準採用時の翌期首の処理方法は？,切放方式||洗替方式,theme07,A,87
ch07-p3-q08,価格変動と原価配分計算が完全に一致する原価配分方法は？,個別法,theme07,A,87
ch07-p3-q09,物の流れと計算の仮定が一致する原価配分方法は？,先入先出法,theme07,A,87
ch07-p3-q10,名目的利益を排除できる棚卸資産の原価配分方法は？,後入先出法,theme07,A,87
ch07-p3-q11,同一価格水準での収益と費用の対応が可能な原価配分方法は？,後入先出法,theme07,A,87
ch07-p5-q01,低価主義の考え方には、保守主義説以外に（①）説と（②）説がある。（①）説とは、取得原価のうち有効な部分のみを次期に繰り越す考え方である。これに対して（②）説は、取得原価のうち回収可能な原価のみを次期に繰り越す考え方である。,有効原価||回収可能原価,theme07,B,89
ch07-p5-q02,有効原価説のもとでは時価として（①）が採用され、回収可能原価説のもとでは時価として（②）が採用される。,再調達原価||正味売却価額,theme07,B,89
ch07-p5-q03,仕入割引の性格に関しては、異なる二つの見解がある。一つは、決済取引を仕入取引とは別個の取引とみて、仕入額を仕入時に確定するものとし、仕入割引は（①）とする見解である。もう一つは、決済取引を仕入取引と連続する一つの取引とみて、仕入額を決済時に確定するものとし、仕入割引は（②）の控除項目とする見解である。,営業外収益||仕入,theme07,B,89
ch07-p7-q01,通常の営業過程で販売するために保有する財貨・用役を2つ示せ。,商品||製品,theme07,B,91
ch07-p7-q02,販売を目的として現に製造中の財貨・用役を2つ示せ。,半製品||仕掛品,theme07,B,91
ch07-p7-q03,販売目的の財貨・用役を生産するために短期的に消費される財貨を2つ示せ。,原材料||工場消耗品,theme07,B,91
ch07-p7-q04,販売・管理活動で短期的に消費される財貨を2つ示せ。,事務用消耗品||荷造用品,theme07,B,91
ch07-p7-q05,購入した棚卸資産の取得原価は？,購入代価＋付随費用|購入代価に付随費用を加算した金額,theme07,B,91
ch07-p7-q06,生産した棚卸資産の取得原価は？,製造原価,theme07,B,91
ch07-p7-q07,棚卸資産の数量計算方法を2つ示せ。,継続記録法||棚卸計算法,theme07,B,91
ch07-p7-q08,仕入割引の取扱いを2つ示せ。,営業外収益||仕入の控除項目,theme07,B,91
ch07-p7-q09,保守主義以外の低価法の考え方を2つ示せ。,回収可能原価説||有効原価説,theme07,B,91
ch07-p7-q10,回収可能原価説で採用される時価は？,正味売却価額,theme07,B,91
ch07-p7-q11,有効原価説で採用される時価は？,再調達原価,theme07,B,91
ch08-p1-q01,売買目的有価証券は（①）の変動を目的として保有する有価証券であり、投資者に有用な情報は（①）であるため、期末（①）を貸借対照表価額とする。また、評価差額は財務活動の（②）であるため、当期の（③）とする。,時価||成果||損益,theme08,A,97
ch08-p1-q02,満期保有目的の債券については、元本および利息の受取額という将来キャッシュ・フローが（①）しており、市場金利の変動による価格変動（②）を考慮する必要がないため（③）で評価する。ただし、（④）と額面金額とが異なる場合の差額が（⑤）のときは、償却原価法を適用する。,確定||リスク||取得原価||取得価額||金利の調整,theme08,A,97
ch08-p1-q03,子会社株式および関連会社株式は、それぞれ企業支配や影響力の行使を目的としており、事実上の（①）に該当するため（②）で評価する。,事業投資||取得原価,theme08,A,97
ch08-p1-q04,その他有価証券について、投資者に有用なのは期末（①）であり、期末（①）を貸借対照表価額とするが、売却には事業遂行上等の（②）があるため、評価差額は当期の損益とはせず、純資産の部に計上する。,時価||制約,theme08,A,97
ch08-p3-q01,売買目的有価証券を時価評価する理由は？,有用だから|投資者に有用だから,theme08,A,99
ch08-p3-q02,売買目的有価証券の評価差額を損益とする理由は？,成果だから|財務活動の成果だから,theme08,A,99
ch08-p3-q03,満期保有目的の債券の貸借対照表価額は？,取得原価,theme08,A,99
ch08-p3-q04,満期保有目的の債券を時価評価しない理由は？,将来キャッシュ・フローが確定しているから|将来キャッシュ・フローが固定しているから,theme08,A,99
ch08-p3-q05,償却原価法が適用される条件は？,取得差額が金利の調整であること|取得価額と額面金額との差額が金利の調整であること,theme08,A,99
ch08-p3-q06,償却原価法の種類は？ 原則と例外を示せ。,利息法||定額法,theme08,A,99
ch08-p3-q07,子会社株式を取得原価で評価する理由は？,事業投資だから|事業投資に該当するから,theme08,A,99
ch08-p3-q08,その他有価証券を時価評価する理由は？,有用だから|投資者に有用だから,theme08,A,99
ch08-p3-q09,その他有価証券の評価差額を損益にしない理由は？,売却に制約がある|売却に事業遂行上等の制約がある,theme08,A,99
ch08-p3-q10,部分純資産直入法の根拠となる考え方は？,保守主義,theme08,A,99
ch08-p3-q11,金銭債権の貸借対照表価額は？,取得価額－貸倒引当金|取得価額-貸倒引当金,theme08,A,99
ch08-p3-q12,貸倒見積高の算出方法を3つ示せ。,貸倒実績率法||キャッシュ・フロー見積法||財務内容評価法,theme08,A,99
ch08-p5-q01,金融資産は、（①）に対する情報提供、（②）の財務認識、国際的調和化という3つの視点から基本的には（③）で評価する。しかし、すべての金融資産が（③）で評価されるわけではなく、市場が存在せず、また、売却に事業遂行上の（④）がある場合は、（③）で評価しない。,投資者||企業||時価||制約,theme08,B,101
ch08-p5-q02,金融資産および金融負債は、その契約締結時から（①）の変動リスクと信用リスクを負うため、契約締結時にその（②）を認識する。,時価||発生,theme08,B,101
ch08-p5-q03,金融資産の消滅の認識に関する考え方には、（①）と（②）がある。（①）とは金融資産のほとんどすべてのリスクと経済価値が移転した場合のみ権利に対する支配の移転を認める考え方であり、（②）は、財務構成要素の部分的な移転を認める考え方である。（①）では、取引の経済的効果を財務諸表に反映できないため、金融資産の消滅の認識に関しては、（②）が採用されている。,リスク・経済価値アプローチ||財務構成要素アプローチ,theme08,B,101
ch08-p7-q01,金融資産を4つ示せ。,現金預金||金銭債権||有価証券||デリバティブ資産,theme08,B,103
ch08-p7-q02,金融資産の特徴を2つ示せ。,市場で客観的な時価を把握できる|市場で客観的な時価を把握できること||時価で換金等できる|時価で換金等できること,theme08,B,103
ch08-p7-q03,金融資産を時価評価すべき視点を3つ示せ。,投資情報||企業の財務認識||国際的調和化,theme08,B,103
ch08-p7-q04,金融負債を2つ示せ。,金銭債務||デリバティブ負債,theme08,B,103
ch08-p7-q05,金銭債務の評価額とその理由は？,債務額、時価がなく市場での清算が困難だから|債務額、時価がなく市場での清算が困難であるため|債務額、時価がなく市場での清算が困難,theme08,B,103
ch08-p7-q06,金融資産の発生の認識を行うのはいつか？,契約締結時,theme08,B,103
ch08-p7-q07,金融資産にあるリスクを2つ示せ。,時価の変動リスク||信用リスク,theme08,B,103
ch08-p7-q08,金融資産の消滅の認識が行われる場合を3つ示せ。,権利を行使した場合||権利を喪失した場合||権利に対する支配が他に移転した場合,theme08,B,103
ch08-p7-q09,金融資産の消滅の認識における権利に対する支配の移転の考え方を2つ示せ。,財務構成要素アプローチ||リスク・経済価値アプローチ,theme08,B,103
ch08-p7-q10,財務構成要素アプローチが採用される理由は？,取引の経済効果を財務諸表に表示するため|取引の経済効果を財務諸表に反映するため,theme08,B,103
ch09-p1-q01,有形固定資産の（①）をその利用期間（耐用年数）にわたり（②）する手続が減価償却である。減価償却の目的は、有形固定資産の（①）を（②）することにより適正な期間（③）を行うことにある。,取得原価||費用配分||損益計算,theme09,A,98
ch09-p1-q02,有形固定資産の減価償却方法には、（①）を配分基準とする方法と（②）を配分基準とする方法がある。理論的には、固定資産の（③）提供に比例した費用を計上する後者が望ましいが、（③）の提供の総量の把握は困難な場合が多く、一般に前者が採用されている。,期間||生産高（利用高）|生産高|利用高||用役,theme09,A,98
ch09-p1-q03,減価償却の目的は、有形固定資産の取得原価の（①）を通じた適正な期間（②）にあるが、（③）と（④）という2つの経済的効果を有する。（③）とは、固定資産に投下された資金が貨幣性資産として回収されることにより流動化することをいい、（④）とは、減価償却費が（⑤）を伴わない費用であるため、同額の取替資金が企業内部に留保される効果をいう。,費用配分||損益計算||固定資産の流動化||自己金融効果||現金支出,theme09,A,98
ch09-p3-q01,減価償却とは？,有形固定資産の取得原価の費用配分|有形固定資産の取得原価を費用配分する手続,theme09,A,101
ch09-p3-q02,計画的・規則的な減価償却を何と呼ぶか？,正規の減価償却,theme09,A,101
ch09-p3-q03,減価償却の目的は？,適正な期間損益計算,theme09,A,101
ch09-p3-q04,減価償却の効果は？,固定資産の流動化||自己金融効果,theme09,A,101
ch09-p3-q05,減価償却における配分基準は？,期間||生産高（利用高）|生産高|利用高,theme09,A,101
ch09-p3-q06,期間を配分基準とした償却方法は？,定額法||定率法||級数法,theme09,A,101
ch09-p3-q07,生産高（利用高）を配分基準とした償却方法は？,生産高比例法,theme09,A,101
ch09-p3-q08,購入した有形固定資産の取得原価は？,購入代価＋付随費用|購入代価に付随費用を加算した金額,theme09,A,101
ch09-p3-q09,製造した有形固定資産の取得原価は？,製造原価,theme09,A,101
ch09-p3-q10,原価算入できる借入金利子は？,自家建設で稼働前の期間対応分|自家建設に係る借入金利子のうち稼働前の期間対応分,theme09,A,101
ch09-p3-q11,贈与により取得した資産の取得原価は？,取得資産の時価|資産取得時の時価,theme09,A,101
ch09-p3-q12,異種資産との交換による取得原価は？,譲渡資産の時価,theme09,A,101
ch09-p3-q13,同種資産との交換による取得原価は？,譲渡資産の帳簿価額,theme09,A,101
ch09-p5-q01,借入金の利子は（①）上の費用であり、通常、固定資産の（②）に算入されない。しかし、自家建設した固定資産の取得に要する借入金の利子のうち稼働前の期間に属する部分については、（③）との対応関係が存在しないことが明らかであり、固定資産の稼働後の収益と対応させるため、固定資産の（②）に算入したうえで、これを（④）することができる。,財務||取得原価||収益||費用配分,theme09,B,103
ch09-p5-q02,有形固定資産を交換により取得した場合は、その取得資産の種類および用途により取得原価は異なる。取得資産が提供資産と同種・同用途である場合は、提供資産の（①）を引き継ぐが、取得資産と提供資産が異なる種類・用途である場合は、譲渡資産の（②）を取得原価とする。,帳簿価額||時価（公正な評価額）|時価|公正な評価額,theme09,B,103
ch09-p5-q03,減価償却とは異なる有形固定資産の費用配分方法に（①）と（②）がある。（①）は取替資産の取替えに要する支出を（③）支出とする方法であり、（②）は減耗性資産の物理的な減少に着目した費用配分方法である。,取替法||減耗償却||収益的,theme09,B,103
ch09-p7-q01,減価償却の経済的効果は？,自己金融効果||固定資産の流動化,theme09,B,105
ch09-p7-q02,自己金融効果とは？,減価償却費相当額の取替資金の留保効果|減価償却費相当額の取替資金が企業内部に留保される効果,theme09,B,105
ch09-p7-q03,固定資産の流動化とは？,固定資産に投下した資金の回収による流動化|固定資産に投下された資金が貨幣性資産として回収されることによる流動化,theme09,B,105
ch09-p7-q04,自家建設により取得した固定資産の借入金利子を取得原価に算入することができる根拠となる原則は？,費用収益対応の原則,theme09,B,105
ch09-p7-q05,同種・同用途資産の交換時に帳簿価額を引き継ぐ理由は？,投資が継続しているから|投資が継続しているため,theme09,B,105
ch09-p7-q06,期間を配分基準とする減価償却方法を保守主義的な順に示せ。,定率法||級数法||定額法,theme09,B,105
ch09-p7-q07,取替法とは？,取替資産の取替費用を収益的支出とする方法|取替資産の取替えに要する支出を収益的支出とする方法,theme09,B,105
ch09-p7-q08,減耗償却とは？,減耗性資産の数量的な減少に着目した費用配分方法|減耗性資産の物理的な減少に着目した費用配分方法,theme09,B,105
ch09-p7-q09,減耗償却と同様の手続をとる減価償却方法は？,生産高比例法,theme09,B,105
ch10-p1-q01,引当金は将来の特定の費用や損失を当期に計上する際に設定される（①）項目であり、その設定目的は適正な期間（②）にある。将来の費用や損失を先取りし、当期に費用計上するために設定されるのが引当金であり、その計上は広義の（③）に該当する。,貸方||損益計算||費用配分,theme10,A,109
ch10-p1-q02,引当金は将来事象に対するものであり、その設定要件は厳格に定められている。将来の（①）の費用または損失に対するものであること、その（②）が当期以前の事象に起因すること、（②）の可能性が高いこと、金額の合理的な見積りが可能なこと、という要件を充足した場合に限り、将来の費用または損失のうち当期に負担する金額を費用計上するために引当金が設定される。,特定||発生,theme10,A,109
ch10-p1-q03,引当金の計上根拠となる損益計算書原則には費用収益対応の原則と発生主義がある。一般的な意味での発生主義は、経済価値の（①）に費用（②）の根拠を求めるが、引当金ではその（③）発生を含めて理解される。,費消||認識||原因,theme10,A,109
ch10-p3-q01,引当金とは？,将来の特定の費用・損失を見積計上する際の貸方項目|将来の特定の費用または損失を見積計上する際の貸方項目,theme10,A,111
ch10-p3-q02,引当金計上の目的は？,期間損益計算の適正化|適正な期間損益計算,theme10,A,111
ch10-p3-q03,引当金の計上根拠としての損益計算書原則を2つ示せ。,発生主義の原則||費用収益対応の原則,theme10,A,111
ch10-p3-q04,引当金の設定根拠となる発生主義の原則における発生の意味は？,経済価値の費消||経済価値の費消とその原因の発生,theme10,A,111
ch10-p3-q05,損益計算書原則以外の引当金の計上根拠は？,保守主義,theme10,A,111
ch10-p3-q06,引当金の設定要件を4つ示せ。,将来の特定の費用または損失であること||その発生が当期以前の事象に起因すること||発生の可能性が高いこと||その金額を合理的に見積もることができること,theme10,A,111
ch10-p3-q07,引当金を貸借対照表の表示面から2つに分けよ。,評価性引当金||負債性引当金,theme10,A,111
ch10-p5-q01,引当金は、貸借対照表の表示の観点から（①）性引当金と（②）性引当金に区分される。このうち（①）性引当金は、繰入額の性格の観点から（③）性引当金、（④）性引当金に区分される。,負債||評価||費用||損失,theme10,B,113
ch10-p5-q02,偶発債務は発生の可能性が低い段階では（①）による開示を行う。発生の可能性が高く、金額の合理的な見積りが可能な段階で引当金が設定される。,注記,theme10,B,113
ch10-p5-q03,引当金も積立金も将来の支出に備える不特定資産の（①）を意味する貸方項目である点が共通する。しかし、引当金が（②）の過程で生じるのに対して、積立金は（②）後の剰余金の処分の過程で生じる点が異なる。,留保||損益計算,theme10,B,113
ch10-p5-q04,未払費用は継続的な役務提供契約に係るものであり、（①）により確定した対価を基礎として計算するのに対して、引当金は（①）を前提とせず、支出額を合理的に見積計上する点が異なる。,契約,theme10,B,113
ch10-p7-q01,負債性引当金を法的な視点から2つに分けよ。,債務である引当金||債務でない引当金,theme10,B,115
ch10-p7-q02,債務でない負債性引当金を1つ示せ。,修繕引当金|特別修繕引当金,theme10,B,115
ch10-p7-q03,負債性引当金をその繰入額の性格から2つに区分せよ。,費用性引当金||損失性引当金,theme10,B,115
ch10-p7-q04,引当金と積立金の共通点は？,不特定資産の留保を意味する|将来の支出に備える不特定資産の留保を意味する,theme10,B,115
ch10-p7-q05,引当金と積立金の相違点は？,引当金は期間損益計算により生じ、積立金は剰余金の処分で生ずる|引当金は損益計算の過程で生じ、積立金は剰余金の処分の過程で生じる,theme10,B,115
ch10-p7-q06,未払費用と引当金の違いは？,未払費用は契約による確定金額を基礎とし、引当金は見積計上する|未払費用は契約により確定した対価を基礎とし、引当金は支出額を合理的に見積計上する,theme10,B,115
ch10-p7-q07,偶発債務の開示方法を2つ示せ。,注記||引当金の計上,theme10,B,115
ch10-p7-q08,偶発債務の注記での開示と引当金計上との違いは？,発生の可能性|発生の可能性が高いか否か,theme10,B,115
ch11-p1-q01,狭義の発生主義による費用であるが、その（①）の（②）が将来の期間に及ぶため経過的に貸借対照表に資産計上された項目が繰延資産である。繰延資産は、その（②）の発現という事実ないし将来の収益との（③）関係という事実に着目して繰延経理が認められている。,支出||効果||対応,theme11,A,119
ch11-p1-q02,繰延資産は、（①）を有せず、いわゆる静態論のもとでの資産性はない。期間損益計算の適正化の見地から資産計上が認められるのが繰延資産である。概念フレームワークでは、資産の本質を（②）の獲得への貢献と捉えており、現行制度上の繰延資産の全てが資産性を有するかは疑問であるが、（②）の獲得に貢献する限り、資産性が認められると考えられる。,換金価値||キャッシュ,theme11,A,119
ch11-p1-q03,現行制度上は、株式交付費、社債発行費等、創立費、開業費、（①）の5項目について繰延資産の計上が認められている。,開発費,theme11,A,119
